"Name","Description","Email","Website","Instagram"
"Aa Dekhen Zara Entertainment","Aa Dekhen Zara (ADZ) is an annual South Asian Dance competition hosted by the students of the University of Wisconsin-Madison. We host 8 talented Bollywood-Fusion dance teams from across the nation who compete for first, second, and third place. Our organization consists of an executive board, as well as liaisons and event managers that work hard to run an amazing show. Since its establishment in 2011, ADZ has brought the Madison community a show that displays music and dance in a competitive setting while also giving the people of Madison a taste of South Asian culture. This year, we are excited to host ADZ XV on February 1, 2025.
If you’re interested in being involved with ADZ, reach out to us via email or follow our social media to stay updated!","adzentertainment@gmail.com","http://adzentertainment.com","No Instagram available"
"Acacia Fraternity - Lamedth Chapter","Acacia is a social fraternity dedicated to human service. We are dedicated to bettering the community we are a part of and sharing a brotherhood we will remember for the rest of our lives. We are a fraternity that is focused on the strength of brotherhood. By selecting key members of the Madison community, we build a brotherhood dedicated to human service for both the community and ourselves. These members are selected through the IFC-regulated RUSH process in which members are first bid followed by a pledge process. We are a non-hazing fraternity built on the idea that disrespect to any possible future member or person is strictly against our goals and morals. All leaders of the Acacia Fraternity are elected by the active members and must be students of the University of Wisconsin-Madison.","acaciawisco@gmail.com","https://acaciawisco.org/","No Instagram available"
"Academy of Managed Care Pharmacy Student Chapter at UW Madison","AMCP is a national professional organization of pharmacists and other health care providers that aims to improve patient outcomes through the merger of both clinical and business knowledge. The student chapter allows those interested to learn more about this subset of pharmacy.
The student chapter seeks to provide students with a greater understanding of the field of managed care pharmacy. Students are provided multiple opportunities to strengthen their knowledge of this area, such as engaging with speakers who are current professionals in the field as well as participating in a national pharmacy and therapeutics competition.","jtwhitbeck@wisc.edu","https://uwmadison.campuslabs.com/engage/organization/amcpuwmadison/contact","No Instagram available"
"Actuarial Club - UW Madison","The Actuarial Club is a student-run organization for those interested in or majoring in actuarial science. A career in actuarial science utilizes a person’s knowledge of math, economics, finance, and risk theory in the business world. Our members range in age from first-year students to graduate students. We encourage interaction among students, faculty, and industry professionals in the actuarial field. We have weekly events including networking with employers, socials, volunteering, mentorship program, intramural sports and more! 
The Actuarial Club strives to:
Provide members with a better understanding of the actuarial field
Create the opportunity to build relationships among actuarial students and faculty
Encourage relationships between students and actuarial professionals
Expose students to professional applications of actuarial science
Provide resources for students taking actuarial exams
Engage in positive community volunteer work
In order to join the Actuarial Club, first join our mailing list by sending an email to our VP of Communications: Anthony Krebsbach at ajkrebsbach@wisc.edu.
Our dues are $35 for the academic year and are payable to our VP of Finance, Alex Zylka, at any event prior to the sign-up deadline.
  Keep your page updated in our actuarial database with exams you're sitting for and have passed as well as internships and full-time positions you've accepted. Here is a link to our database: https://apps.bus.wisc.edu/actuarialevent/.
  Additional questions/requests can be addressed to any of the following Club Officers:
Sarah Bloemer (President) - sbloemer@wisc.edu
Jodie Lam (VP Educational Enrichment) - kklam2@wisc.edu
Anthony Krebsbach (VP Communications) - ajkrebsbach@wisc.edu
Aidan Bandte (VP Member Relations) - bandte@wisc.edu
Ethan Farr (VP Social Media and Marketing) - ejfarr@wisc.edu
Alexander Zylka (VP Finance) - aczylka@wisc.edu
Stephanie Hayd (VP of Diversity, Equity, and Inclusion) - hayd@wisc.edu","actsciclub@wsb.wisc.edu","https://www.actuarialclubuw.org/","No Instagram available"
"Advancing Diversity and Excellence in Physical Therapy","Advancing Diversity and Excellence in Physical Therapy (ADEPT) develops and supports pathways to excellence for young people from groups currently underrepresented in the physical therapy profession.
ADEPT also strives to foster a strong community of physical therapy students who are knowledgeable about the experiences of underrepresented peoples and equipped to address health disparities.
ADEPT members will:
Conduct community outreach through programs that promote diversity in higher education
Plan activities for young people designed to inform them about the PT profession
Offer students a forum to discuss issues that will increase their ability to effectively provide culturally sensitive care and address health disparities
Develop diverse programmatic initiatives with the goal of increasing the cultural competency of the DPT student body 
Support group members’ goals to advance diversity in the health sciences through peer-to-peer mentorship and resource sharing","ADEPT.uw@gmail.com","https://uwmadison.campuslabs.com/engage/organization/adept/contact","https://www.instagram.com/adeptuwm/"
"Adventist Christian Fellowship - Madison","Hey there, we are so glad you've visited our page!
We are UW-Madison students who at some point in our lives started to ask deep questions and wonder about God and such things, and then experienced that God is actually a loving and good God, and, thus, we really want to share with others the life-changing power of the Bible here, on campus, in our busy, everyday lives, which can be full of problems, worries, and struggles.
Why is it cool?) The acronym ""ACF"" explains it very well, though it may seem hard to understand at first:
A - Adventist. Adventists emphasize that the imminent second coming (""advent"") of Jesus gives hope to each one of us because this will be the day when our whole life, regardless of how it was, can be made perfect, and we can become fully happy, just as God planned it to be.
C - Christian. Christians know that Jesus loved each person, each identity, and each individual so much, that He decided to give up everything (including His life) so that we may be restored, and our lives - fulfilled. This focus on His amazing love is something that can truly change your life and ours.
F - Fellowship. We all have a deep longing for a community and fellowship, and no one likes to feel alone or excluded, though this often happens on such a big campus as ours. But when we get to know God's love, we are so filled with it that we naturally tend (and are able) to share this gift with our community, while being focused on Jesus. No community becomes more united than the one where God is at the center.
  Still wondering what all these words like ""God's love"", ""fulfillment"", ""true community"" or ""belonging"" mean?
Come and join our next event, and you'll figure it out!
If you have any questions about our organization, please email Slava C. (primary contact) at cherempei@wisc.edu.","cherempei@wisc.edu","https://uwmadison.campuslabs.com/engage/organization/acf-m/contact","No Instagram available"
"Adventure Learning Programs","ALPs challenges people through adventure-based team building workshops using group games, initiatives, high and low ropes courses, and other challenges to learn more about themselves and one another. ALPs recognizes diversity and unity in all groups and facilitates dialogue toward understanding these qualities based on common human values. Through ground, roving, high and low ropes workshops, ALPs seeks to help all UW student groups become more effective, productive and unified through shared experiences. ALPs works to create a strong sense of community among all members of the UW-Madison area.
  Workshops are free of charge to all registered UW-Madison students.  Complete our workshop request form to request a workshop. Visit recwell.wisc.edu/alps/ for more information about our workshops we offer!
  ALPs is a student organization as well as a job.  To join our organization, you need to be hired as a facilitator.  We hire at the beginning of each Fall and Spring semester with applications due at the end of September or first week in October with new staff hired by Thanksgiving. We also hiring starting in early February! Contact us at alps@studentaffairs.wisc.edu in August or January if you are interested in joining our talented group of facilitators.","alps@studentaffaris.wisc.edu","https://recwell.wisc.edu/alps/","No Instagram available"
"Advertising Club","So you’ve found our awesome club? Here’s a brief overview on why you should join!
OUR GOAL: Build the next generation of advertising professionals. 
HOW: By preparing our members for the advertising world with unique and formative experiences, similar to that of an agency. 
WHO WE ARE: A creative, unique and welcoming group of students looking to challenge ourselves, make connections and share our passion for advertising! 
WEEKLY MEETINGS: At our weekly meetings, you'll hear from advertising professionals about their climb to the top, day-to-day experiences and award-winning campaigns. They will also share secrets to breaking into the industry, provide tips and skills for success, and share creative work samples.
AD CLUB AGENCY: Working on your portfolio? In addition to our general meetings, Ad Club also has sub-group we call our ""agency."" Anyone can join agency as long as they pay general Ad Club membership dues. Ad Club agency meets on a weekly basis, and students are assigned to different “clients” based on their specialized interests in advertising. The agency groups work on an integrated campaign for another student organization or local business, their ""client,"" for the semester.
SOCIALS: While Ad Club's focus is professional, we're not shy about having fun. Our socials are great ways to meet other members and network – other people who will one day be your friends, colleagues or bosses.","adclubwisc@gmail.com","https://uwmadison.campuslabs.com/engage/organization/adclub/contact","https://www.instagram.com/adclubwisc"
"Advocates for Alzheimer's","Advocates for Alzheimer's is an organization for all UW-Madison students interested in learning more and raising awareness about Alzheimer's disease. Our mission is to increase awareness for Alzheimer's and raise funds to find a cure for this disease. AFA will provide education to young family members affected by Alzheimer's disease and will enable students to share their experiences with each other.","afa@rso.wisc.edu","https://uwmadison.campuslabs.com/engage/organization/afa/contact","https://www.instagram.com/afabadger/"
"Advocates for Immigrants' Rights","The purpose of Advocates for Immigrants’ Rights (AIR) is to represent the interests of students advocating for immigrants’ rights through networking, community outreach, education, and mentorship.","air.uwlaw@gmail.com","https://uwmadison.campuslabs.com/engage/organization/advocatesforimmigrantsrights/contact","https://www.instagram.com/airwisco/"
"Advocates for Rare Diseases","Advocates for Rare Diseases is an organization dedicated to increasing awareness and fundraising for individuals impacted by rare diseases. Our organization is open to all undergraduate UW-Madison students passionate about raising funds for research and eager to learn more about rare diseases. Each semester ARD members collaborate to choose one rare disease to educate ourselves as a club on, spread awareness to the campus community, and develop a fundraising event to support research.","ardwisco@office365.wisc.edu","https://groupme.com/join_group/102747085/4JFfahL2","No Instagram available"
"African Christian Fellowship (UW-Madison)","ACF UW-Madison is affiliated to ACF Madison, and by extension ACF USA. Founded in 1977, ACF USA now has over 50 chapters across different cities of the United States. The UW-Madison chapter is home for African students in the University.
    The Fellowship have the following objectives:
A. To provide and promote Christian fellowship and worship. 
B. To teach and mobilize Christians for effective Godly living and Christian ministry. 
C. To minister and support evangelization and missions on the premise that Jesus Christ is Lord and Savior of all nations.
D. To build and maintain bridges of understanding, unity, and cooperation among Christians of differing descent, origin, heritage and experience.
E. To strengthen families.
F. To positively impact Africa’s spiritual and economic development.
G. To otherwise engage in any lawful activities which are consistent with its religious, educational, and charitable existence.","mosesoluwanifise@gmail.com","https://uwmadison.campuslabs.com/engage/organization/acf-uwmadison/contact","www.instagram.com/acfuwmadison"
"African Students Association","ASA is a multicultural student group at the University of Wisconsin - Madison. Our mission is to promote cultural and social awareness of African students amongst the entire student body and faculty of our university. We work to facilitate better communication and understanding between African students and other members of the university community, while encouraging activities that portray the noble cultural treasures of the African continent.
Anybody and everybody is welcome to become a member. People can join ASA for many reasons including making new friends and learning the rich and colorful cultures of Africa, just to mention a few!","badgerasa@gmail.com","http://eepurl.com/iaA5-v","No Instagram available"
"AHANA-MAPS Pre-Health Society","AHANA stands for African, Hispanic, Asian, and Native American. We are a student organization grounded in the belief of providing students with an essential, well-rounded perspective of the healthcare field, enriching experiences, and community service opportunities.
AHANA strives to provide platforms for undergraduates to share experiences common to students entering health professions.
AHANA facilitates social and educational meetings to facilitate fellowship among students interested in minority health concerns.","ahanaprehealthsociety@gmail.com","https://uwmadison.campuslabs.com/engage/organization/ahanaprehealthsociety/contact","https://www.instagram.com/ahana_maps/"
"AI in Medicine - UW Madison","In an era of rapid technological evolution, the medical field stands at the cusp of a paradigm shift. The integration of Artificial Intelligence (AI) into medical practices promises advancements in diagnostics, treatment planning, research, and patient care. As the next generation of medical professionals, it is imperative for students to understand and be at the forefront of this transformative journey. The University of Wisconsin-Madison, with its rich history of research and innovation, is ideally positioned to foster this understanding through the formation of an ""AI in Medicine"" club. Our goal is to create a multidisciplinary platform for students of all backgrounds to explore, understand, and innovate in the convergence of AI and medicine, while promoting diversity, inclusion, and collaboration. We will aim to empower students with the knowledge and skills in AI, ensuring that the future of medicine remains patient-centered, equitable, and technologically advanced.
  Interested? Fill out our membership form! https://docs.google.com/forms/d/15k4iU_bo9THPX1K6LD9f0aqM_qsp8s0U7L253hh5Bew/edit","Aiinmedicineuw@outlook.com","https://uwmadison.campuslabs.com/engage/organization/aiinmedicine/contact","No Instagram available"
"AIGA Wisconsin UW-Madison","AIGA UW-Madison is a group for students interested in graphic design. Connected to the national AIGA and the Wisconsin chapter of AIGA, AIGA UW-Madison provides students with an opportunity to learn more about the graphic design community at the University.  It also allows students to learn about the practice of graphic design as a profession.  AIGA UW-Madison connects students with similar interests in the design field.  Connection with the local and national chapters creates networking opportunities for students.  AIGA is nationally recognized, and students can benefit from participation with the group before entering professional practice.","aigauwmadison@gmail.com","https://uwmadison.campuslabs.com/engage/organization/aigauwmadison/contact","https://www.instagram.com/aigauwmadison/"
"Aim High","At Aim High, our mission is to empower high school students by providing free, high-quality ACT/SAT tutoring. We ensure that all students, regardless of background, have the opportunity to access higher education and achieve their highest potential.","agopal4@wisc.edu","https://uwmadison.campuslabs.com/engage/organization/aimhigh/contact","No Instagram available"
"Albanian American Student Organization","The Albanian American Student Organization at UW Madison is a vibrant and inclusive community dedicated to exploring, celebrating, and preserving the rich history of Albanian culture. Our organization serves as a dynamic platform for students to immerse themselves in the beauty and diversity of the Albanian culture. Through engaging events, informative meetings, and cultural showcases, we work to provide deeper understanding on what it means to be an Albanian. We provide a welcoming space for Albanian (and non-Albanian) students to forge meaningful connections, cultivating friendships and a sense of belonging that extends beyond the campus boundaries. By actively participating in both on-campus and off-campus Albanian events, we ensure that our members play an integral role in the broader Albanian community while fostering a spirit of unity, pride, and cultural exchange.","akjonuzi@wisc.edu","https://uwmadison.campuslabs.com/engage/organization/aaso/contact","https://www.instagram.com/aaso.uwmadison/"
"Alexander Hamilton Society UW-Madison Chapter","The Alexander Hamilton Society (AHS) is a non-partisan, not-for-profit, national organization that seeks to identify, educate, and launch young people into foreign policy and national security careers imbued with the Hamiltonian perspective of strong and principled American leadership in global affairs.","ahswisconsin@gmail.com","https://ahswisconsin.wixsite.com/my-site","No Instagram available"
"Allied Scholars For Animal Protection UW-Madison","ASAP focuses on both short term (1-5 years) and long term (20-30 years) changes. By providing a unified infrastructure, ASAP ensures for the first time that there is a strong, effective, sustained, and united effort to end animal oppression on campuses across the country. The students we train and mentor will become the next generation of industry leaders in health, medicine, journalism, the environmental sciences, business, academia, government, law, and the nonprofit world.  
https://www.youtube.com/watch?v=PhHpJqkCzRs","Ryan@alliedscholars.org","https://www.alliedscholars.org/uwmadison","No Instagram available"
"Alpha Chapter of Alpha Chi Sigma","Alpha Chi Sigma is a co-ed professional chemistry fraternity founded at the University of Wisconsin-Madison in 1902. Alpha Chi Sigma is a national organization with chapters across the country and has numerous faculty members on campus in the Chemistry, Chemical Engineering, and Biochemistry departments. Alpha Chi Sigma strives for the advancement of chemistry both as a science and as a profession, provides a free chemistry tutoring program for students, and participates in science and non-academic outreach events. We focus on academic and professional development but also on forming lifelong friendships. We have members majoring in Chemistry, Biology, Biochemistry, Chemical Engineering, Neuroscience, Microbiology, Animal Science, Botany, Food Science, Psychology, and more!
Check out our official website for more information: http://alphachisigmauw.com/","axsalphachapter@gmail.com","http://alphachisigmauw.com/","No Instagram available"
"Alpha Chi Omega - Kappa Chapter","","axopresident.kappa@gmail.com","https://uwmadison.campuslabs.com/engage/organization/alphachiomega/contact","https://www.instagram.com/axowisconsin/"
"Alpha Epsilon Delta (PreHealth Honor Society), Wisconsin Beta Chapter","Please visit our new website, https://uwmadisonaed.wixsite.com/uwaed, for up-to-date information.
To Join AED please send an email to srajesh3@wisc.edu
Alpha Epsilon Delta is a pre-health honors society that is a Beta chapter of the national AED here at the University of Wisconsin-Madison campus.  At our general bi-weekly meetings we have a variety of physician speakers and other pre-health related speakers to advance you in your undergraduate career. We host volunteer events to help you get involved in the Madison community, Public Relations events to learn how to manage life as a pre-health student, and social events to blow off steam from our crazy, busy schedules and spend time with other pre-health students!
While there are many pre-health orgs on campus, ours is unique in that we have a partnership with the UW Surgery Department that allows our active members to shadow in surgery (check it out here:  Surgical Shadowing Program | Alpha Epsilon Delta (uwmadisonaed.wixsite.com). Other events we offer are the phlebotomy and CPR courses, which are highly valuable to a pre-health student. Additionally, many of us have volunteered at one of Madison’s three hospitals, so we are more than able to help you find a volunteering position.","dhoondia@wisc.edu","https://uwmadisonaed.wixsite.com/uwaed","No Instagram available"
"Alpha Epsilon Phi - Sigma Chapter","Alpha Epsilon Phi is a national sorority, founded October 24, 1909, by seven women, dedicated to helping women become the best they can be. These seven women were searching for a group of young women that would contribute to the growth of its members emotionally, intellectually and socially. We are a sorority that strives to inspire and support exemplary women dedicated to friendship and a lifelong commitment to sisterhood, while building on the vision of our founders. We prize individuality, encouraging each member to discover and develop the talents and abilities that make her unique. But just as we value individuality, we also prize togetherness, fostering friendships and a sense of belonging. When becoming a part of AEPhi, you are not just becoming a member of a sorority; you are becoming a sister in a family, full of love, trust and understanding that lasts a lifetime.
Alpha Epsilon Phi has two national philanthropies. Sharsheret is a national nonprofit organization of cancer survivors dedicated to addressing the unique challenges young women living with breast cancer deal with on a day to day basis. Elizabeth Glazer Pediatrics AIDS Foundation, our second national philanthropy, is one of the leading pediatric AIDS organizations. Elizabeth was a member of AEPhi Sigma Chapter, and while giving birth to her first child, she was transfused with blood that was infected with the AIDS virus, which she unknowingly passed along to her two children. The Elizabeth Glaser Pediatric AIDS Foundation is a nonprofit organization dedicated to preventing pediatric HIV infection and eliminating pediatric AIDS through research, advocacy, and prevention, care, and treatment programs. 
  Multa Corda Una Causa, Many hearts One purpose.","aephisigma.president@gmail.com","https://wiscophi.com","No Instagram available"
"Alpha Gamma Rho - Iota Chapter","Alpha Gamma Rho is a social/professional fraternity for men interested in the study of agriculture and who want to become actively involved on campus. We also have a vast alumni network that assists with career development and connections.","agriotaproud@gmail.com","http://www.wisconsinagr.com","No Instagram available"
