"Name","Description","Email","Website","Instagram"
"Slavic Graduate Student Organization","The Slavic Graduate Student Organization serves as a facilitator between the Graduate Students in the Slavic unit of the Department of German, Nordic, and Slavic at UW-Madison and the faculty of said Department. The GSO pledges to discuss student concerns and redress these concerns to the faculty at monthly faculty meetings. Additionally, the GSO pledges to organize cultural and social events that will strengthen the bonds of our Slavic community.  The GSO will also host professional development workshops and/or academic colloquiums.","rlent@wisc.edu","https://uwmadison.campuslabs.com/engage/organization/slavicgso/contact","No Instagram available"
"Sláinte Irish Dancers - UW Chapter","Sláinte Irish Dancers is a student organization dedicated to creating opportunities to college-aged dancers to continue practicing, performing, and competing while at UW-Madison. In addition to performances both on and off campus throughout the school year, we compete at the Mid-American Oireachtas and College Irish Dance Association National Championships where we have previously taken home first place in certain events! Please don't hesitate to reach out to our Executive Board with any questions--Sláinte!","madisonslainte@gmail.com","https://uwmadison.campuslabs.com/engage/organization/slainteirishdancers/contact","https://www.instagram.com/madisonslainte"
"Social and Environmental Business Advocates","At SEBA, we believe that businesses have an important role to play in working towards social and environmental justice in our communities. The Wisconsin School of Business (WSB) plays an important role in preparing students to create an equitable business world through social justice, sustainability, and non-profit careers.
Through SEBA we hope to engage the student body of the Wisconsin School of Business in order to create conversations about the culture of the business world and the WSB. SEBA creates a place where students can express concerns, ideas, and opportunities to build a more inclusive and diverse definition of business. We organize events such as roundtable discussions with faculty and students to discuss how to create a more inclusive and sustainable culture and career networking nights for students interested in business sustainability. 
Our meetings this semester will be Tuesdays at 8 p.m. in room 2270. Feel free to reach out if you would like to be a part of the mailing list for more information! You can also learn more about us on our website (https://sebauw.weebly.com/) and our Instagram (@seba_uw).
Be the change you want to see in the world! Join SEBA to get involved in actively creating conversations and change to make the business world a better place!","sebaexec@office365.wisc.edu","https://sebauw.weebly.com/","No Instagram available"
"Social Tennis - UW-Madison","The Social Tennis Club at UW-Madison allows all students to connect and play tennis with other UW community members. We do not have any tryouts to join and have a strict no-cut policy based on skill level. We meet weekly for a 75-minute hitting/practice session. This club will also host tournaments during the semesters to bring our community together through friendly and fun competitions.","dkagnoff@wisc.edu","https://uwmadison.campuslabs.com/engage/organization/socialtennisuwmadison/contact","https://www.instagram.com/wisctennis.socialleague/"
"Society for Ecological Restoration Student Association: UW-Madison","The mission of the Society for Ecological Restoration Student Association–UW Madison is to follow the official Society of Ecological Restoration’s (SER) guiding principles in order to connect students, faculty and the extended UW community to volunteer, education, and research opportunities and efforts that are related to the science and practice of restoration ecology.
  In order to fulfill our mission we will pursue the following objectives:
  Develop a Volunteer program that will facilitate an interface between Association members, experts in the field, and related groups that focuses on active restoration projects.
Develop an Education and Outreach program to inform the community about ecological restoration concepts and importance and to actively engage the community in protection and restoration of local areas.
Create an Academic Development program that connects Association members to research opportunities and to encourage discussion in restoration ecology topics.
Bridge the gap between students with interests in restoration and ecology and volunteer, research, academic and job opportunities outside the Association.","ser.uwmadison@gmail.com","https://uwmadison.campuslabs.com/engage/organization/seruw/contact","No Instagram available"
"Society for Human Resource Management","Welcome to the Society for Human Resource Management chapter at UW-Madison! Join SHRM for exciting professional growth and networking prospects. Attend workshops, guest speakers, company tours, and connect with students, recruiters, and experienced professionals.
Members have the opportunity to attend speaker, social, community service, and DEI events, along with having access to publications that equip business professionals for their future roles as strong leaders. As part of SHRM, you'll gain access to a diverse range of professional development events, empowering you to network with fellow students, elevate your skills, and embrace the WSB community. 
The Society for Human Resource Management at UW-Madison is open to all young professionals who are interested in developing human resource knowledge and skills.","shrm.uwmadison@gmail.com","https://shrmuwmadison.wordpress.com/","No Instagram available"
"Society of American Archivists-Student Chapter","The Society of American Archivists Student Chapter at the University of Wisconsin-Madison is a student forum for the expression of ideas relating to the activities of the Society of American Archivists and the archives community. The chapter acquaints its members with the objectives, ethics, and publications of the Society of American Archivists. The chapter also promotes a forum for professional members in the archival community to speak to students interested in the archives profession. We encourage communication among members sharing an interest in the documentation of the human experience, and interaction with other student groups to promote the mutual interests of the library and archives professions.","mmriordan@wisc.edu","https://uwmadison.campuslabs.com/engage/organization/saa-sc/contact","No Instagram available"
"Society of Hispanic Professional Engineers UW-Madison Student Chapter","The concept of Networking was the key basis for the organization. SHPE quickly established two student chapters to begin the network that would grow to encompass the nation as well as reach countries outside the United States. Today, SHPE enjoys a strong but independent network of professional and student chapters throughout the nation.
The Society of Hispanic Professional Engineers (SHPE) was founded in Los Angeles, California, in 1974 by a group of engineers employed by the city of Los Angeles. Their objective was to form a national organization of professional engineers to serve as role models in the Hispanic community.
Statement of Values: We are brought together by heritage, social responsibility and desire to improve the equality of all people through the use of science and technology. We value excellence in education, professional pursuits and leadership. We obtain excellence through integrity, empowerment, achievement, diversity and continuous improvement.
Vision: SHPE's vision is a world where Hispanics are highly valued and influential as the leading innovators, scientists, mathematicians and engineers.
Mission: SHPE changes lives by empowering the Hispanic community to realize its fullest potential and to impact the world through STEM awareness, access, support and development","shpemadison@gmail.com","https://shpeuwmadison.wisc.edu/","No Instagram available"
"Society of Manufacturing Engineers Student Chapter S133","Society of Manufacturing Engineers Student Chapter S133, hereinafter called SME Student Chapter S133, is the official student chapter supported by the Society of Manufacturing Engineers(SME), which is a nonprofit association leading the manufacturing industry internationally.
SME Student Chapter S133 is a student society organized by students who are interested in Manufacturing Engineering and advised by Professor Hantang Qin in the Industrial Systems and Engineering department.
We organize various events including kick-off meeting, a table tennis tournament, and board game.","vbansal5@wisc.edu","https://uwmadison.campuslabs.com/engage/organization/sme/contact","No Instagram available"
"Society of Petravores","Our fundamental purpose is to facilitate the scheduling of non‐alcoholic social events and volunteer opportunities geared towards members of the UW Marching Band, although membership is open to any student enrolled at least part time as either an undergraduate or graduate student. Our goal is to give students a social atmosphere outside of practices and Game day performances. We aim to hold one main swing dance event a semester as a formal event for the band, but other events may include ice skating nights, a large screen showing of the fall’s musical etc.","azwhitson@wisc.edu","https://uwmadison.campuslabs.com/engage/organization/societyofpetravores/contact","No Instagram available"
"Society of Plastics Engineers, University of Wisconsin Student Chapter","The main purpose of the SPE Student Chapter is to provide and promote the scientific and engineering knowledge relating to plastics, supplement formal education and enhance professional development.","clin349@wisc.edu","https://uwmadison.campuslabs.com/engage/organization/4spe/contact","No Instagram available"
"Society of Women Engineers","The Society of Women Engineers (SWE), founded in 1950, is a not-for-profit professional and service organization. SWE is the driving force that establishes engineering as a highly desirable career aspiration. SWE empowers individuals to succeed and advance in those aspirations and be recognized for their life-changing contributions and achievements as engineers, computer scientists, and leaders.
Mission Statement: Stimulate individuals to achieve full potential in careers as engineers, computer scientists, and leaders, expand the image of the engineering and technology professions as a positive force in improving the quality of life, and demonstrate the value of inclusion, equity, and diversity.
The Society of Women Engineers section has three main focuses: personal development, inclusion & outreach, and professional development. 
Our SWE section is involved in the following types of events:
Inclusion & Outreach
Girl Scouts Patch Days
Engineering Tomorrow’s Careers Camp
Day on Campus for Admitted Students
School Outreach Programs (Science Olympiad, Family Science Nights, Girl’s Inc., etc.)
Community Service (Blood Drives, Card Making for Hospitalized Kids, etc.)
Engineering Expo
Office of Inclusion Education workshops
Professional Development
Monthly Section Meetings
Industry Tours
Evening with Industry
Technical Workshops
National and Local Conferences
Boeing Tech Team Competition
Personal Development
Mentoring Program
New Member Committee
For more information, please visit our website: http://swe.slc.engr.wisc.edu/","sweofficersuw@gmail.com","http://swe.slc.engr.wisc.edu/","No Instagram available"
"Socratic Society","The Socratic Society is a reading group for UW Law School students interested in legal theory and legal history. We meet regularly during the fall and spring semesters to discuss selected provocations from legal academia and other disciplines, literary fiction, theatre, film, and more.","sevart@wisc.edu","https://uwmadison.campuslabs.com/engage/organization/socraticsociety/contact","No Instagram available"
"Software Development Club","Welcome to the Software Development Club! We are a vibrant community dedicated to enhancing students' skills in computer science and software engineering/development through collaborative learning and projects. Throughout the semester, we facilitate semester-long group projects that allow members to apply their knowledge in real-world applications, fostering teamwork and innovation.
In addition to projects, we host regular meetings, seminars, and workshops on a variety of topics within computer science and related fields. Our sessions cover essential skills such as resume building, career advice, and technical topics like algorithms and data structures. These events are designed to deepen our understanding of core CS concepts, enhance our professional development, and provide valuable insights into academic success.
Whether you're a seasoned coder or just beginning your journey in software development, our club offers opportunities to grow, learn, and connect with like-minded individuals passionate about technology. Join us and explore the exciting world of software development with a supportive community eager to share knowledge and advance together.
Join our discord for all updates on meetings and projects: https://discord.gg/JfbbDVEG3z
If you would like to join the club, please attend the Student Org Fair and find our booth, or join our discord. DO NOT ask to join on the WIN page or message the organization, this account is not actively monitored and your request may not be received.","wisconsinsdc@gmail.com","https://uwmadison.campuslabs.com/engage/organization/softwaredevclub/contact","https://www.instagram.com/uwsoftwaredevelopmentclub"
"Soils Club - UW-Madison","The Soils Club welcomes any student interested in soils and serves to support a soil judging team. Soil judging is a team-based activity to build field-based soil characterization skills and includes opportunities for intercollegiate competitions. Optional commitments include weekly teaching sessions and weekend field days. Teaching sessions include lectures, activities and trainings on soil description. Field days are typically 3-5 hours and include hands on field training in identifying landscapes and classifying soils. Come out and have fun connecting over shared love of nature, science and soil!","handerson33@wisc.edu","https://uwmadison.campuslabs.com/engage/organization/soilsclub/contact","www.instagram.com/soiljudging_uwmadison"
"Solis","Solis is a group dedicated to improving student life by fostering a community that supports and promotes women and gender minorities in plasma science, both here within the UW-Madison campus and in the plasma science field as a whole. We also aim to share our passion for plasma science with younger women and gender minorities in STEM through educational outreach. A major focus of our group is to improve mentorship within the plasma science community by facilitating access to mentorship education and resources for students and faculty.","cschaefer6@wisc.edu","https://solis.engineering.wisc.edu/","No Instagram available"
"Somali Student Association","The Somali Student Association (SoSA) at UW-Madison is dedicated to creating a welcoming and inclusive environment for both Somali and non-Somali students, faculty, and staff. We organize a range of engaging events and gatherings that provide immersive experiences in Somali culture, including cultural events, and educational workshops. These events are designed to celebrate the rich heritage of Somali culture while fostering cross-cultural understanding and dialogue. By hosting open discussions and collaborative activities, SoSA helps build a strong sense of community and encourages mutual respect among diverse groups on campus.","sosa.uwmads@gmail.com","https://uwmadison.campuslabs.com/engage/organization/somali/contact","https://www.instagram.com/sosa_uwmadison/"
"South East Asian Dance Organization","The purpose of SEADO is to educate the campus and Madison community about Southeast Asian cultures through dance. With dance, SEADO seeks to unify Southeast Asian cultures and learn to appreciate the uniqueness of each. SEADO also promotes understanding and exploration of personal and cultural identities in addition to providing opportunities to develop community and self-awareness, friendships, confidence, and leadership skills.","seadowisc@gmail.com","https://uwmadison.campuslabs.com/engage/organization/seado/contact","https://www.instagram.com/seadowisc/"
"South East Asian Student Association","The South East Asian Student Organization (SEASA) is an organization that serves as a bridge between the different Southeast Asian communities on our campus, connecting students, staff, and faculty members alike. We envisioned SEASA as a platform capable of fostering a safe and inclusive space where students from diverse ethnic backgrounds within the Southeast Asian community can gather to share their experiences, strengths, and challenges. To celebrate, promote, and spread awareness of Southeast Asian cultures, heritage, and traditions. Together, we can work towards our personal growth and contribute to the improvement of our community, whether through academic pursuits or direct engagement.","seasa.uwmadison@gmail.com","https://uwmadison.campuslabs.com/engage/organization/seasa/contact","http://www.instagram.com/seasa_uwmadison/"
"Southeast Asia Research Group","SEARG is an open forum designed to facilitate and develop the community of UW-Madison students whose general interests engage with Southeast Asia, its peoples, and the diaspora of those with heritage from the region. SEARG strives to recognize and incorporate the invaluable perspectives of students with Southeast Asian heritage, but students of any and all racial, ethnic, sexuality, or gender identities are welcome. While many members are currently at the graduate level, SEARG also welcomes the participation of undergraduates interested in the region and its peoples. Meetings take the form of panels and forums designed to both develop the work of individual members and to share best practices both in the academy and the field.","SEARGUW@gmail.com","https://uwmadison.campuslabs.com/engage/organization/searg/contact","No Instagram available"
"Spanish Club at UW-Madison","The purpose of Spanish Club at UW-Madison is to enhance its members proficiency in the Spanish language and expand the interest, knowledge, and enjoyment of Spanish and Latin American culture. Students of any Spanish-speaking level are welcome, as the meetings are conducted in English and Spanish. The general meetings include games, speaker presentations, and open discussions. Topics that are covered range from study abroad to Spanish as a Major, Spanish in careers, current events, and culture. Our social events include viewing Spanish films, dinners at Spanish and Latin American restaurants, Zumba dance night, and more. Two other important components of Spanish Club are fundraising events and volunteer opportunities.","spanishclub@rso.wisc.edu","https://uwmadison.campuslabs.com/engage/organization/spanishclubatuwmadison/contact","No Instagram available"
"SPIE/Optica Student Chapter at UW-Madison","The SPIE/Optica Student Chapter of UW-Madison strives to bring students together with common interests of optics, photonics, and instrumentation. We wish to promote awareness of these interests on campus through organized seminars and discussions and to disseminate knowledge of the field of Optical Engineering. Along with networking and outreach education, we also strive to facilitate the professional development of our student members.","spie.optica.uw@gmail.com","https://spieopticamadison.org/","No Instagram available"
"Splish Splash","Welcome to Splish Splash, the premier club for medical students who share a passion for swimming and wellness! Nestled within the bustling world of academia, Splish Splash offers a refreshing escape for aspiring doctors and healthcare professionals alike.
Picture a vibrant community of like-minded individuals, united by their dedication to both academic excellence and physical well-being. As members of Splish Splash, medical students dive into the invigorating waters of camaraderie, support, and shared enthusiasm for swimming.
Our club provides a sanctuary where students can unwind, recharge, and forge lasting connections outside the lecture halls and labs. Whether you're a seasoned swimmer or just dipping your toes into the pool for the first time, Splish Splash welcomes all skill levels with open arms.
Amidst the soothing rhythm of strokes cutting through the water, members find a sense of balance amidst the rigors of medical school. From early morning laps to evening workouts, our diverse range of swimming sessions accommodates busy schedules and fosters a holistic approach to student well-being.
Join Splish Splash today and dive into a world where academic pursuit and physical fitness converge, where friendships are forged, and where the water beckons as a source of rejuvenation and inspiration.","kylieruprecht0@gmail.com","https://uwmadison.campuslabs.com/engage/organization/splishsplash/contact","No Instagram available"
"Sports Analytics Club, UW-Madison","Sports Analytics Club, UW-Madison's goal is to provide students of all experience levels with the opportunity to complete meaningful research using data of any sport. Meetings will consist of workshops, guest speakers, presentation practice, and opportunities to start projects with a special emphasis on major competitions in sports analytics. 
Please reach out to the primary contact to get involved through our group chat!","sshah77@wisc.edu","https://wiscosac.wordpress.com/","No Instagram available"
"Sports and Entertainment Law Society","The Sports and Entertainment Law Society (SELS) hosts educational and networking events for University of Wisconsin Law School students in order to promote a better understanding of sports and entertainment law. This society seeks to build a bridge between the law students and those who can offer academic and career advice in the sports and entertainment law sectors.","wiscsels@gmail.com","https://uwmadison.campuslabs.com/engage/organization/sels/contact","https://www.instagram.com/selsuwlaw/"
"Sports Business Club","The primary goal of the Sports Business Club is to connect UW-Madison students to the sports Industry via good people and good times. This takes on extra meaning because UW does not offer a sports-related degree, program, and/or any sort of significant resources for students to get involved in the industry so that’s where we come in. In this club, you’ll get exposed to these main things....
Informative Speaker Events & Trips
Professional Development
Community Service
Internship Opportunities
A Community of Students with Similar Career Aspirations
Check us out at....
Website: www.sbcuw.org
Social Media: Instagram, Twitter, LinkedIn, Facebook","sportsbcuw@gmail.com","http://www.sbcuw.org","https://www.instagram.com/sbcuw/"
"Sports Girls Club (UW-Madison)","","poos@wisc.edu","https://uwmadison.campuslabs.com/engage/organization/sportsgirlsclub/contact","instagram.com/girlsclubwisco"
"Sports Media Club at UW","Sports Media Club is here to connect fans and aspiring sports media professionals at the University of Wisconsin. The club will serve as a space for collaboration, community, and creativity within the world of sports and sports media. Our goal is to help students create sports media content of all kinds (podcasts, TikToks, articles, graphics) and find their voice. 
  Kickstart a media brand: collaborate with club members or go solo
Network with professionals (via speaker events)
Engage with your peers (via competition events)
Improve your media skill sets (via workshops)
Influence the conversations about the NBA, NFL, MLB, FIBA and much more
  Socials:  Instagram, Twitter, TikTok
Website:  Articles, Features, Polls and This Week In Sports
Calendar: Workshops, speakers and upcoming events","sportsmediauw@gmail.com","https://uwmadison.campuslabs.com/engage/organization/sportsmediaclub/contact","https://www.instagram.com/sportsmediauw/"
"Sports Medicine and Athletic Healthcare Club","Click ""Join"" to be added to our WIN club roster and email list!
Join our GroupMe for updates:
https://groupme.com/join_group/103417319/ftKxaMdu
Email SMAHCUW@gmail.com or message Ella Schroeder on GroupMe with any questions!","smahcuw@gmail.com","https://uwmadison.campuslabs.com/engage/organization/sportsmedicineandathletichealthcareclub/contact","https://www.instagram.com/wiscosmahc/"
"Sports Medicine Interest Group","The Sports Medicine Interest Group at the University of Wisconsin School of Medicine and Public Health provides medical students opportunities to gain experience and exposure to the field of Sports Medicine. Events held will include lunch talks, tours, panel discussions, and hands-on workshops. Topics will include, but are not limited to:
            -The different pathways to becoming a sports medicine physician
          -What practicing in sports medicine entails
          -How to best prepare yourself as a competitive applicant to sports medicine fellowships
          -Common sports injuries, treatment, and prevention techniques
  We will work with faculty, fellows, and residents at UW Health to gain exposure to the specialty of Sports Medicine.","bskalitzky@wisc.edu","https://uwmadison.campuslabs.com/engage/organization/smig/contact","No Instagram available"
