"Name","Description","Email","Website","Instagram"
"Lambda Theta Alpha Latin Sorority, Inc. - Gamma Mu Chapter","","lta.gammamu@gmail.com","https://uwmadison.campuslabs.com/engage/organization/lambdathetaalpha/contact","https://www.instagram.com/lta_gammamu/?hl=en"
"Lambda Theta Phi Latin Fraternity Inc. - Gamma Theta Chapter","Lambda Theta Phi Latin Fraternity, Inc. was founded on December 1, 1975 in Union , New Jersey at Kean University . We made history as the first nationally recognized Latino Fraternity. In the Spring of 2006, Lambda Theta Phi Latin Fraternity, Inc. became the first Latino Fraternity at the University of Wisconsin-Madison. The ideals of this brotherhood are the following: Academic Excellence; Brotherhood; Leadership; Latino Unity; Service.
The purpose of Lambda Theta Phi Latin Fraternity, Inc. is to provide the Latino college student the opportunity to be part of a family with a mission. Our mission is to cultivate a spirit of brotherhood, to value an education, to promote unity among all Latinos, to be proud of and cherish our heritage, to assert roles of leadership, to develop character, to practice chivalry, and to serve mankind. Though we are historically Latino based, we are not solely a Latino Fraternity. We have Brothers of all different races, religions, and national origin.","gammatheta.lambdas@gmail.com","https://uwmadison.campuslabs.com/engage/organization/gtlambdas/contact","https://www.instagram.com/gtlambdas/"
"Lao and Cambodian Student Association","The Lao and Cambodian Student Association strives to build a cohesive community within students of all ethnicities interested in learning about Laotian and/or Cambodian culture. Our mission is to reach out to the campus and extended community and enrich them with the culture of Laos, Cambodia, and all of Southeast Asia. Our focus will also be geared towards collaboration events with diverse organizations on campus with the hope of building a solid network of students and mentors.","lcsa.uwmadison@gmail.com","https://uwmadison.campuslabs.com/engage/organization/lcsa/contact","https://www.instagram.com/lcsa_uw/"
"Latine Pre-Law Student Association","LPSA was founded to help Latine students at the University of Wisconsin-Madison navigate through undergraduate and prepare them for law school. By creating a welcoming space for Latine students, LPSA aims to establish a community of prospective law students who will not only help each other but also the Latine community throughout Wisconsin.","lpsauwmadison@gmail.com","https://uwmadison.campuslabs.com/engage/organization/lpsa/contact","https://www.instagram.com/lpsamadison/"
"Latine Student Union","The purpose of the Latine Student Union is to bring together all UW-Madison students who hold a Latine identity and/or ally to build a strong community and presence on campus. We serve as advocates for all Latine-identifying students and educate our peers, faculty, and staff regarding our needs to be successful. This organization hopes to provide resources, spaces, and serve as a support group to all Latine students on campus.","latinestudenunion@gmail.com","https://uwmadison.campuslabs.com/engage/organization/lsu/contact","https://www.instagram.com/lsu_uwmadison/?hl=en"
"Latino Medical Student Association (LMSA) UWSMPH","The Latino Medical Student Association (LMSA) UWSMPH  organization aims to introduce students to the health challenges of the Latine population and their access to healthcare in Madison. LMSA’s mission is to represent, educate, and unify Latino/a/e medical students at the University of Wisconsin School of Medicine and Public Health. Unidos is the Spanish word for united. This organization was formed with the belief that all health professional students, regardless of personal, ethnic, or racial background, can work together to combat the health disparities that currently exist in the Hispanic population. This mission is achieved by the following pursuits: education on health-related issues affecting Hispanic patients and communities through noon talks and events; mentorship for Latino/a/e undergraduate pre-health students through our work with PALMA; collaboration with peers and faculty through partnership with MSMC and the Office of Multicultural Affairs; and support for Latine students at UWSMPH, including networking opportunities through participation in regional and national conferences.","mbenito@wisc.edu","https://uwmadison.campuslabs.com/engage/organization/lmsa/contact","https://www.instagram.com/lmsa_uwsmph/"
"Leaders Igniting Transformation","https://m.youtube.com/watch?v=AEQG-uocCUM","lituwmdn@gmail.com","https://uwmadison.campuslabs.com/engage/organization/litwi/contact","http://instagram.com/lit_uwmdn"
"Leadership in Adapted Fitness","Leadership in Adapted Fitness (LAF) is a student organization that functions to support our Adapted Fitness Program. As an organization, we plan and host adapted events beyond our structured schedule in the Adapted Fitness classroom. Over the semester, we fundraise through selling Adapted Fitness apparel, hosting a penny war, and selling baked goods. All of the proceeds from our fundraising go towards our adapted events so that they can be free and accessible for all. 
We have A LOT of fun events planned for this year including working with RecWell to host Badger Adapt, partaking in adapted skiing with the Birkie Ski Race up north, and much more! LAF also works to organize the Adapted Fitness open house and plan activities to make our community welcoming such as creating birthday cards for our clients. 
LAF is a great opportunity to meet others across different Adapted Fitness sections, continue to have the opportunity to work with individuals with diverse abilities if you were unable to be a part of one of our Adapted Fitness sections this semester, or to be more involved in our program. We would love to have you join us and see what it is all about!","leadershipinadaptedfitness@gmail.com","https://uwmadison.campuslabs.com/engage/organization/leadershipinadaptedfitness/contact","https://www.instagram.com/wiscoadaptedfitness/?next=%2F"
"Leading Women of Tomorrow - UW Madison","Leading Women of Tomorrow is a student run, nonpartisan initiative that seeks to encourage more undergraduate women to consider careers in public service, with the aim of bridging the gender gap among public representatives. We believe the key to addressing the underrepresentation of women in government is to cultivate interest in the next generation. Our three main goals are to inspire, prepare, and empower women of tomorrow. We do this by sparking interest in public service and giving women the confidence to excel. We teach women leadership principles and professional skills. We encourage women to apply themselves and become leaders in their field.","lwtmadison@gmail.com","https://www.leadingwomenoftomorrow.com/","No Instagram available"
"Lens Into Future Technologies","Lens Into Future Technology (LIFT) is an undergraduate student organization dedicated to fostering scientific curiosity and research skills among high school students and UW-Madison undergraduate students. By offering engaging opportunities and outreach events in microscopy and scientific research, LIFT not only equips undergraduate students with valuable research and leadership skills but also provides them with unique access to advanced and typically inaccessible technology. Through these initiatives, LIFT aims to ignite enthusiasm for science among high schoolers by offering them a unique perspective on scientific exploration through the lens of microscopy.","narichmond@wisc.edu","https://uwmadison.campuslabs.com/engage/organization/lift/contact","No Instagram available"
"Letters Of Love UW-Madison","Letters Of Love is a qualified 501(c) non-profit organization that partners with college students to provide emotional support to children battling cancer and other illnesses. Letters of Love UW-Madison hopes to connect students with the above mission.
Letters Of Love UW-Madison is a student lead organization founded in 2022. The organization's main mission is to provide moral support to children battling cancer and other illnesses by creating hand-crafted cards. These heartfelt letters bring immeasurable joy and hope to children in their greatest time of need. We want each and every child to know that they are loved, supported, and never alone; that they have a whole team fighting right along with them, giving them support each step of the way. We are that team, and we hope you will join us to put smiles on the faces of our superheroes.
Although the primary purpose of our charter is to create cards, we are not limited to them. Letters Of Love UW-Madison believes there are an infinite number of ways that we can further foster support and awareness for children in hospitals around the globe. This can be seen by past Letters Of Love sponsored fundraisers, item drives, and student galas.
The room for creativity and kindness within Letters Of Love is endless. We, as students, hope to foster an inclusive community where all members have the possibility to make a positive impact within a child's life.","lol.uwmadison@gmail.com","https://uwmadison.campuslabs.com/engage/organization/lettersoflove/contact","https://www.instagram.com/lettersoflove_uw/"
"Leukemia & Lymphoma Society at UW-Madison","The Leukemia & Lymphoma Society at UW-Madison (LLS@UW) is a student-run organization that supports the LLS mission to cure blood cancers and improve the quality of life of patients and their families. We work to fulfill these goals through student involvement in research, service, and advocacy efforts. We also attend the annual Madison Light the Night walk and host our annual Dodge the Dark dodgeball tournament for our large fundraising events! Our regular events include guest speakers, volunteer events, fundraising events, our annual Combating Cancer panel, and social events. We are always looking for creative and unique ways to engage our cancer community more and support cancer patients and families to a greater extent! We welcome all who are passionate about the mission and ready to join the generation to cure cancer!","llsuw@rso.wisc.edu","https://llsuw2.wixsite.com/lls-uw","No Instagram available"
"Linguistics Student Organization","The Linguistics Student Organization (LSO) welcomes everyone who studies language. Our main goals are the promotion of scholarship, camaraderie, and peer support among the students, and the representation of the student body to the faculty.","rhietpas2@wisc.edu","https://uwmadison.campuslabs.com/engage/organization/linguistics_student_organization/contact","No Instagram available"
"Lutheran Campus Ministry at UW-Madison","About Us
Lutheran Campus Ministry is a place for all students regardless of religious affiliation (or lack thereof). If you are a UW-Madison, MATC, Edgewood College, or any other post-secondary student this place is for you. 
Lutheran Campus Ministry is a ministry of the Evangelical Lutheran Church in America (ELCA) and our ministry is made possible by the South Central Synod of Wisconsin, Luther Memorial, Bethel Lutheran, and over 30 other partner congregations.
Our Mission
Responding to God’s call, Lutheran Campus Ministry creates an affirming community that provides students with opportunities to deepen faith, engage minds, and serve neighbors.
Lutheran Campus Ministry is centered in Jesus Christ’s embodiment of the love and grace of God. In that spirit, we welcome all UW-Madison, MATC, and Edgewood students, faculty, and staff to be a part of this community of faith, worship, service, and fellowship.","info@lcmmadison.org","http://lcmmadison.org/","No Instagram available"
"MACH Music Store","","mach_acapella@outlook.com","https://uwmadison.campuslabs.com/engage/organization/mach_musicstore/contact","No Instagram available"
"Mad Gaffers","We are a group of students, faculty, community members and all those interested in glass art who’s goal is to expand the knowledge of glass working through fundraising for trips and networking with other glass communities in the Midwest Region.
As we work with the UW Madison Glass Department, we focus on raising funds for field trips to see galleries and conferences in the Midwest Region, such as SOFA (Sculptural Objects and Functional Art) and GAS (Glass Art Society), as well as events such as the Glass Olympics. We also focus on connecting with other glass communities to further enhance the glass movement in our Madison campus.","mseverett@wisc.edu","https://uwmadison.campuslabs.com/engage/organization/madgaffers/contact","https://www.instagram.com/mad_gaffers/"
"MadHacks","The MadHacks Organization promotes and executes hackathon events that connect creators, mentors, sponsors, and hackers of all backgrounds and skill levels into a cooperative UW-Madison hackathon community.
If you want to participate in MadHacks, do not apply on this WIN page. Applications are only available through the application form at https://madhacks.io.","team@madhacks.io","https://uwmadison.campuslabs.com/engage/organization/madhacks/contact","No Instagram available"
"MadHatters Men's A Cappella","The MadHatters, based out of Madison, Wisconsin, are the premier men’s a cappella group of the UW campus. Founded in 1997, the MadHatters were the first of its kind at UW and have seen their humble beginnings boom into sold-out shows across campus filled with adoring fans. Comprised of 11 singers and a vocal percussionist, the MadHatters croon the songs of decades past to the Top 40 present.

Built on the foundation of goofy guys making good music and bringing fun to the community, the MadHatters have achieved much success in their short life. From filling the seats at Madison’s historic Orpheum Theatre and acclaimed Overture Centre to singing the National Anthem at a sold-out Brewers/Cubs rivalry at Miller Park, to traveling across the United States and Mexico, the MadHatters seem to have their world on a string and their opportunities endless.

The MadHatters have one live and six studio albums and are working on their seventh studio recording to be released later this year. Their first album released in 2002, State Street, had a track earn a spot on the 2002 Best of College A Cappella (BOCA) CD and is credited as the first a cappella album recorded in 5.1 Dolby Digital Sound. Their second album, 2004’s Friday After Class, exploded their fan base, becoming a “best seller” on a cappella website worldwide. Not For Credit, their third studio release was produced in 2007 and received two national recording awards, including another BOCA inclusion with “I Believe (When I Fall in Love).”
With their unmistakable attire in their Wisconsin red jackets, the MadHatters are a presence on the UW campus that brings everyone to clap their hands and stomp to the beat. Not only does the audience enjoy the show, but the MadHatters love performing it. Whether it be another sold-out show in Madison or singing at your grandma’s 80th birthday party, the MadHatters bring the fun wherever they go.
They’ll dance, they’ll shout (shout!) and they’ll shake your bodies down to the ground. They are the MadHatters.
Thank you for your interest in the group - we'd love to see you at a show sometime soon!","madhattersuw@gmail.com","https://www.madhattersuw.org/","No Instagram available"
"Madison Abortion and Reproductive Rights Coalition for Healthcare at University of Wisconsin-Madison","We are affiliated with the Madison Abortion and Reproductive Rights Coalition for Healthcare. We are dedicated to educating and advocating for reproductive rights for all following the reproductive justice framework.","marrchuw@gmail.com","https://uwmadison.campuslabs.com/engage/organization/marrchuw/contact","https://www.instagram.com/marrchuw/"
"Madison Anime Club","The Madison Anime Club exists to not only spread the appreciation of Japanese animation, but it also exists to provide opportunities to help connect the anime fans of the UW and the city of Madison together through watching anime. We host weekly meetings on Wednesday and Saturdays where we have anime showings and social gatherings. We also organize meetups with other student orgs and members of the Madison community, be it movie nights or cosplay shows. We've also planned group excursions to anime and gaming conventions, including AMKE and ACEN.
  Check our website for the latest information; also join our Facebook group and page to get updates and join our growing online community:
Site: https://madanimeclub.wordpress.com/
Page: https://www.facebook.com/madanimeclub/
Group: https://www.facebook.com/groups/madanimeclub/","xliu2275@wisc.edu","https://madanimeclub.wordpress.com/","No Instagram available"
"Madison Association of Turkish Students","MATS aims to contribute to the cultural diversity of the UW-Madison campus by introducing the Turkish culture to UW students as well as fostering interaction between the members of the Turkish community at the UW-Madison and  students from all countries represented on campus.","mtsa.pa@gmail.com","https://uwmadison.campuslabs.com/engage/organization/mats/contact","https://www.instagram.com/mats_uwmadison?igsh=MWZ6bWgycHBzYThkMQ%3D%3D&utm_source=qr"
"Madison Bowling Club","The history of bowling is long and complex: peppered with surprises, shocks, and turns and twists. Everyone can bowl, and have a great time doing it. It is one of the most popular games to play in a social setting, or during a night out with friends. But how much do you really know about this game that everyone enjoys? We welcome all people in Madison, no matter the skill level nor prior experience.  Attendance to every meeting is not required.  We are also a non-alcoholic club. The Madison Bowling Club exists to bring people of similar interests together in order to practice, grow, learn, and meet new people.  If you like to bowl or have wanted to start and learn, this is the club for you!  We meet in the basement of Union South, Sett Recreation.","mgulbrandsen@wisc.edu","https://uwmadison.campuslabs.com/engage/organization/bowling/contact","No Instagram available"
"Madison Business Mentoring","Madison Business Mentoring (MBM) is a student organization affiliated with the Wisconsin School of Business that helps students prepare for the business world by pairing each student with a professional mentor. Mentors are UW graduates currently working in a variety of business disciplines or MBA students with prior work experience. 

Founded in the fall of 2010 by five Wisconsin School of Business students and advised by the BBA, MBM aims to encourage professional development and help students of all majors gain insight into the post-graduation phase by setting the stage for a strong mentoring relationship.","madisonbusinessmentoring@gmail.com","https://uwmadison.campuslabs.com/engage/organization/mbm/contact","http://instagram.com/mbmuwmadison"
"Madison Coders","","madcodersuw.main@gmail.com","https://uwmadison.campuslabs.com/engage/organization/madcoders/contact","No Instagram available"
"Madison Delta Phi Lambda Sorority, Inc.","We are the Tau Chapter of Delta Phi Lambda Sorority, Inc. here at the University of Wisconsin Madison. We are an Asian-Interest, but NOT EXCLUSIVE, Sorority built upon decades of hard work from our trailblazing chapters. We value the well being of our earth, our community, and ourselves, as we center our focus on empowering others to speak their truth and work to make positive change in our community. We understand the pressure and stress of college and we've created a space where members have the support of a home away from home. We uphold seven virtues: loyalty, honesty, respect, dedication, integrity, discipline, and academic excellence; and support two philanthropies: American Bone Health and Natural Conservation and Environmental Protection Awareness. Our organization empowers everyone to speak up and be unapologettically themselves. Unity and allyship are things we hold close to our hearts, as we ground ourselves in love, respect, and acceptance.","samanthamcqueen02@gmail.com","http://www.madisondphil.org/","No Instagram available"
"Madison Esports Club","Madison Esports Club brings together a diverse group of students who share an interest in a variety of video games. Whether you enjoy casually playing single and/or multiplayer games or prefer the more intense competitive games, there's a little bit in it for everyone! We provide members with opportunities to play in tournaments, watch events together, and hang out in our brand new 12 PC Esports space, opening in the Bakke Recreation & Wellbeing Center. Throughout the semester we hold in person events where members can hang out and participate in raffles, enjoy free pizza, and other small activities like bowling or rock climbing.
  We compete against other universities across the country in games like Valorant, League of Legends, Rocket League, CS2, Call of Duty, Overwatch 2, Smite, Rainbow Six Siege, and Apex Legends. However, we are in no way limited to just those, and in our main discord server we have all sorts of other games including anything related to Nintendo, Minecraft, FIFA, and more. If you have any interest in gaming, then you belong here. 
  We frequently organize viewing parties for professional esports events like the League of Legends Worlds Finals, VCT Series Events, and club-hosted tournaments.
Communication within the club usually happens in our discord server, so feel free to hop in and join us!
https://discord.gg/tUtF5aD
Connect with us on Facebook, Twitter or Email.
linktr.ee/madisonesports","madisonesportsclub@gmail.com","https://uwmadison.campuslabs.com/engage/organization/madisonesportsclub/contact","https://www.instagram.com/madisonesports/"
"Madison Fashion Business Collective","Guest Speakers: Every few months, invite industry professionals (fashion influencers, media execs, entrepreneurs) to talk about their work.
Workshops: Social media strategies, personal branding, fashion trends, business development, etc.
Collaborations: Partner with other clubs or local organizations for events, pop-ups, or workshops.","glgoldberg@wisc.edu","https://uwmadison.campuslabs.com/engage/organization/madisonfashionmediacollective/contact","No Instagram available"
"Madison Fighting/Rhythm Games","The Madison FGC (Fighting Game Community) / RGC (Rhythm Game Community) seeks to help connect fighting and rhythm game players with one another to share their passion for the genres.
  A variety of both fighting games and rhythm games are played, not limited to: osu!, Guilty Gear, Street Fighter, Tekken, King of Fighters, and Bemani titles! We host a variety of events for said games every week, including both online (just ask in our Discord below!) and offline at club meetups! We also have active playerbases for other various online games, such as 100% Orange Juice, Final Fantasy XIV, Mahjong, and Gacha Games! 
  There are no dues or requirements, just come by or join the Discord if you're looking to play games!
  Join our Discord for more info: https://discord.gg/pshMujdcE2","madison.fgc@gmail.com","https://uwmadison.campuslabs.com/engage/organization/madisonfgc/contact","No Instagram available"
"Madison Marketing","Madison Marketing is a student run organization that connects students with local businesses in Madison for hands-on marketing experience. This includes social media, email, marketing events, consumer analytics, community/campus outreach, other digital types of marketing and more. Students will learn how to better their communication skills by not only working with businesses but also by working with peers and reporting status updates to an executive board. We also collaborate with industry leaders many times throughout the year to give our members a comprehensive understanding of marketing and foster professional development opportunities. This is a great resume builder and way to get involved in the community. You do not need to be in the business school or a marketing major to apply. 
We currently work with Forage Kitchen, Poke Plus, Ian's Pizza, Dragonfly Hot Yoga, Pure Green, Run Madtown, Pure Recovery, Java Den, Grand Central, X01, and Wisconsin Design Team. To get involved, make sure to follow us on Instagram (@madisonmarkeinguw) and check out website (madisonmarkeinguw.com) for updates on when applications open. We recruit new members in the beginning of the Fall and Spring semesters!","madisonmarketinguw@gmail.com","https://www.madisonmarketinguw.com/","No Instagram available"
"Madison Misnomer, The","The Madison Misnomer is a multimedia news organization, publishing articles, videos, and other forms of media across campus and online. We host weekly meetings for those interested in joining, as well as offering leadership opportunities and a creative space to develop as a writer and comedian. The Misnomer is a forum that allows anyone interested to publish unfiltered commentary on the world, campus events, politics, and student life.","madisonmisnomer@gmail.com","https://www.madison-misnomer.org","No Instagram available"
