"Name","Description","Email","Website","Instagram"
"Collegiate DECA, UW Madison Chapter","The goals of this organization shall be:
To ensure effective organizational planning
To develop leadership skills and communication skills
To secure adequate financial resources for the organization to fulfill its mission
To develop high ethical standards in personal and professional relationships
To clearly define and display the organization’s mission, accomplishments and goals
To further develop occupational competencies needed for careers in business
  One way students have the opportunity to develop and practice professional development skills and networking is through a state competition, which takes place in the spring. Those who qualify have a chance to go on to nationals.
For more information, please check out our website.","kbuth@wisc.edu","https://sites.google.com/view/collegiatedeca-uwmadison/home","No Instagram available"
"Collegiate Farm Bureau at The Unviersity of Wisconsin-Madison","Collegiate Farm Bureau is a student-run organization that works to promote agriculture on the University of Wisconsin-Madison campus.  As a voice for agriculture at UW, Collegiate Farm Bureau connects students through agricultural advocacy, education, professional development, and interaction with industry leaders.","albender2@wisc.edu","https://cfbuwmadison.wordpress.com/","No Instagram available"
"Colombian Badgers","The purpose of Colombian Badgers is to unite, support, and promote Colombian culture at the University of Wisconsin-Madison.","colombianos_en_uw@rso.wisc.edu","https://uwmadison.campuslabs.com/engage/organization/cb/contact","No Instagram available"
"ColorStack at UW-Madison","📚 Welcome to ColorStack at UW-Madison! We are a community of students passionate about technology and diversity.
-
💻 ColorStack's mission is to increase the number of Black and Latinx students who graduate and go on to start rewarding technical careers.
-
🧠 Founded in 2021, ColorStack at UW-Madison proudly stands as the second chapter of the national ColorStack organization.
-
👤 To become a member, visit our website and fill out our membership form.
-
🔔 To learn more, follow us on Instagram and LinkedIn, and join our Discord! You can find all our available links and resources via our LinkTree: linktr.ee/colorstackatuw.
-
📧 Email us: colorstackatuw@gmail.com","colorstackatuw@gmail.com","https://colorstack.cs.wisc.edu/","https://instagram.com/colorstackatuw"
"Communication Arts Student Association","CASA works to hold interesting and engaging events for all members. During the 2023-2024 academic year CASA hosted events such as a professor panel, resume & cover letter workshop, networking opportunities, work-life balance workshop, and socials. Whether you are looking to learn more about communications or to network with peers and industry leaders, CASA has an event for you! 
  Overall, CASA has the goal for its members to meet and network with students, alumni, and professionals within the Communication Arts major in order to offer the opportunity for further growth and development within this exciting major.","castudentassociation@gmail.com","https://uwmadison.campuslabs.com/engage/organization/casa/contact","https://www.instagram.com/casa_uwmadison/?hl=en"
"Community Health Volunteers of Madison","Our mission is to bring awareness of health disparities that affect the greater Madison area, to understand the medical, social, political, and economic aspects of health, and to work with underserved populations with the goal of improving health outcomes. We do this by providing volunteer and clinical opportunities that enable students to combat and learn more about the disparities that exist in our current health system.","fpzhou@wisc.edu","https://uwmadison.campuslabs.com/engage/organization/chvm/contact","https://www.instagram.com/chvmuwmadison/"
"Compassion in Action","Badgers Compassion in Action is a student-led organization at University of Wisconsin-Madison dedicated to helping Madison's homeless community. Through biweekly meetings, members will participate in fundraising and distribution events. Badgers Compassion in Action will facilitate outreach and compassion within the Badger community.","smjaffe2@wisc.edu","https://uwmadison.campuslabs.com/engage/organization/compassioninaction/contact","No Instagram available"
"Concrete Canoe Team","The Concrete Canoe Team provides a fun atmosphere for applying engineering principles learned in the classroom, along with learning important team and project management skills needed in the career world. 
This organization challenges the teams knowledge, creativity and stamina, while showcasing the versatility and durability of concrete as a building material. Team members can get involved with concrete mix development, canoe design, construction, and paddling. The team gains points in competition from final product, technical paper, presentation, and co-ed races. (Yes, it floats!)","madisonconcretecanoe@gmail.com","https://uwmadison.campuslabs.com/engage/organization/canoe/contact","http://instagram.com/concretecanoeuwmadison/"
"Consciousness Science Club","We talk about topics such as Neural Correlates of Consciousness, Theories of Consciousness, Theories of Mind, Sleep studies, conscious states, disorders of consciousness, non-human consciousness, et cetera.","react-select@1.2.1","https://uwmadison.campuslabs.com/engage/organization/consciousness-science-club/contact","No Instagram available"
"Construction Engineering Club","In 1997 the Construction Club was established to serve the needs of students in the Construction Engineering and Management program.  The primary goal of the Construction Club is to foster contacts between UW engineering students and the design and construction industry.  The Construction Club is an umbrella organization for student chapters of AGC (Associated General Contractors), NECA (The National Electrical Contractors Association), MCAA (The Mechanical Contractors Association of America) and CSI (The Construction Specifications Institute).
Some of the major activities that students can get involved in include The Construction Club Banquet, Careers in Construction Night, meetings with construction professionals, and project site tours. This year we are also getting involved in community service projects dealing with construction that will allow students the opportunity to work next to experience construction personnel.","cclub@cae.wisc.edu","https://uwmadison.campuslabs.com/engage/organization/cclub/contact","https://www.instagram.com/constructionclubuw/"
"Content Creator Club","We strive to provide a community for content creators across the UW Madison campus, including but not limited to those who create on social media platforms such as: YouTube, Twitch, Tok-tok, Soundcloud, Spotify, Twitter, Instagram, Facebook and more.
We will strive to provide an environment where members are able to collaborate with others, improve their own skills, help others improve their skills and create content.
To connect with us you can find us at the Fall or Spring Org Fair and join our discord!","mjrice2@wisc.edu","https://discord.gg/ptt3JVWAaA","No Instagram available"
"Coptic Orthodox Student Association","The association's main goals are to:
1) Socially and spiritually serve the Coptic Orthodox student body on Campus.
2) Create a vibrant Coptic Orthodox student body to assist in the campus community.
3) Allow new and out-of-state students settle in the Madison community.
4) Create an organization were Coptic students can feel home and welcomed.","cosabadgers@gmail.com","https://uwmadison.campuslabs.com/engage/organization/cosa/contact","No Instagram available"
"Corporate Finance Club","Corporate Finance Club is a professional development organization that focuses on preparing students for engagements with corporate professionals, provides opportunity for engagement and most importantly prioritizes the placement of students into finance internships and full-time positions.
This mission is accomplished through professional development events, mock interviews, social and volunteering outings, and through meaningful networking and other engagement opportunities with employers.
Our organization is chock full of ambitious, passionate and committed students ready for an opportunity to break into the corporate finance space, and we can’t wait to get you in the door!
Please click here to access our website.","Mgwartman@wisc.edu","https://uwmadison.campuslabs.com/engage/organization/corporatefinanceclub/contact","https://www.instagram.com/uwmadison.cfc/?igsh=MXhsYm0yeTl2dXFvag%3D%3D&utm_source=qr"
"Costume Play and Design Guild","The Costume Play and Design Guild of UW Madison is a gathering of people interested in costume play, less formally known as cosplay, of all genres, including, but not limited to: anime, video games, pop culture, and cultural fashions such as steampunk, lolita, etc. The purpose of the club is to encourage creativity and freedom of self expression through cosplay and costume design. We will inspire and assist one another in the process of creating said cosplays and we wish to share knowledge and skills relevant to the creation of costumes. It is our goal to spread the awareness of cosplay and it's history through the UW Madison community. No experience is necessary, and cosplayers of all skill levels are welcome.","badgercostumeplay@gmail.com","https://uwmadison.campuslabs.com/engage/organization/costumeguild/contact","http://www.instagram.com/badgercostumeplay"
"Criminal and Juvenile Justice Student Association","It shall be the purpose of the Criminal and Juvenile Justice Student Association to help students prepare for the Criminal Justice Certificate Program internship, share career planning and graduate school advice, and introduce students to various careers and volunteer opportunities within the criminal justice field.","cjjsa1@gmail.com","https://uwmadison.campuslabs.com/engage/organization/cjjsa/contact","https://www.instagram.com/cjj.sa/"
"Crossing, The","The Crossing is a progressive, multi-faith, nonprofit student organization that offers a place to
· BELONG in a welcoming community,
· EXPLORE faith and spirituality through any religious tradition or belief systems,
· learn to ADVOCATE in meaningful ways for justice and human rights issues important to you,
· continue to BECOME your authentic self.
  As a progressive campus faith community, The Crossing affirms:
LOVE IS ESSENTIAL
FREEDOM OF RELIGION MEANS ALL RELIGIONS
SACRED TEXTS REQUIRE CRITICAL QUESTIONING
LGBTQ+ ARE BELOVED
TRANS IS BEAUTIFUL
EARTH CARE IS OUR RESPONSIBILITY
WOMEN’S RIGHTS ARE HUMAN RIGHTS
NO HUMAN IS ILLEGAL
ANTI-RACISM IS DAILY WORK
BLACK LIVES MATTER
WAR IS A PROBLEM, NOT A SOLUTION
THE EXAMPLE OF JESUS GUIDES & EMPOWERS
    The Crossing encourages students to find their own language and voice for talking and thinking about God and religion. Students will feel affirmed and celebrated at The Crossing, they will learn from student-peers, and grow with their own self-discoveries
  For more info on our Welcome Events and programs, go to:
the gallery section of our WIN page (where you are now!)
thecrossinguw.org
@thecrossinguw on Instagram","crossingstudentorg@outlook.com","https://www.thecrossinguw.org/","No Instagram available"
"CS&D Students of Color Affinity Space","The Students of Color Affinity Space (SOCAS) is a student-led organization within the Department of Communication Sciences and Disorders that was founded in 2021 to provide a safe and supportive space for students of color at various points in their educational journey. They welcome students of all educational levels, including undergraduate, masters, and doctorate level students.
  SOCAS will host a variety of events throughout the year, including:
Informal monthly meetings to discuss experiences, create a networking community, and create mentorship relationships
Resource workshops for graduate school applications, scholarships, and other funding opportunities for students of color
Department-wide cultural learning events to highlight and celebrate various cultures","lacollins4@wisc.edu","https://csd.wisc.edu/inclusion/affinity-spaces/","No Instagram available"
"Curling Club of UW-Madison","A community for those interested in the sport of curling. CCUW offers competitive play for experienced curlers as well as learn-to-curl opportunities for anyone interested. The purpose of the Curling Club of UW-Madison is to teach curling to University of Wisconsin-Madison students; to represent the University of Wisconsin-Madison on the national level of competitive curling; and to instill in each of its members the values central to curling: integrity, teamwork, and self-betterment.","mjmaeder@wisc.edu","https://recwell.wisc.edu/curling/","No Instagram available"
"Curriculum and Instruction International Student Association at UW-Madison","The mission of the association shall be to promote the academic and social well-being of members
Promoting the academic well-being of members include but not limited to:
seeking for, and providing information on courses, programs and activities that are of interest to members
organizing periodic colloquia to provide opportunity to members to develop their presentation skills
facilitating collaborative research and publication for members with similar academic interests
organizing orientation for new international students at the beginning of every academic year, and any other time when orientation would be needed
creating opportunities for senior graduate students to mentor others in areas such as preparing for preliminary exams, proposal writing, dissertation defense, grant writing and similar topics of interest
  Promoting the social wellbeing of members include but not limited to:
facilitating the arrival and settlement of new students
creating opportunities for friendships and cultural exchange
organizing social programs such as potlucks, picnics, games night,and so forth to provide networking opportunities for members 
facilitating the provision of educational outreach and cultural presentations on Campus and beyond","psutar@wisc.edu","https://uwmadison.campuslabs.com/engage/organization/ciisa/contact","No Instagram available"
"Cybersecurity UW","Cybersecurity UW (CSEC) is a student organization that allows its members to learn and explore security in a collaborative environment. This includes everything from security research to lessons on online privacy and safety.
Our club has many goals we are trying to achieve and some of the following are:
- Discussion room based on hacking subjects (Such as the NSA codebreaker and hack the box)
- Teach skills relevant to cybersecurity
- Enable a collaborative environment for cybersecurity based team projects
- Learn how to manage your digital footprint and shared online information
- Create an environment for people to explore and experiment with security
- Host events to help share information with the general public
Cybersecurity UW club is focused on both students with and without Cybersecurity experience. Having experience with programming and Linux/Unix will help with some activities in the club. We enable cybersecurity enthusiasts to collaborate on research and discovery, and to teach cybersecurity beginners how to run and use (white-hat) hacking programs (like metasploit) and other cybersecurity relevant tools (such as API's). If you are interested in joining, please reach out to us!
  We also have a Cybersecurity UW discord server, which you can join using the following link: https://discord.gg/ZvjTAKmfuD","csec@ischool.wisc.edu","https://csec.cs.wisc.edu","No Instagram available"
"Cycle Forward","Cycle Forward creates a positive and immediate impact by collecting in-kind and cash donations that are used to fund the bulk purchase of sanitary products, which we then distribute to menstruators in need through food pantries, shelters, and other organizations that directly serve under-resourced menstruators. Cycle Forward's mission also includes raising awareness about the lack of access to sanitary products; promoting increased accessibility of sanitary products in public spaces; and de-stigmatizing menstruation by creating awareness through dialogue and education, and encouraging girls to attend school even while menstruating.","ewalner@wisc.edu","https://sites.google.com/wisc.edu/cycle-forward-chapter/home","No Instagram available"
"Cycling Club at the University of Wisconsin-Madison","See our updated website! wisconsincycling.org
  The Wisconsin Cycling Club is a student organization that promotes healthy lifestyles on and off the bike. The club consists of both leisure cyclists as well as racers who compete throughout the country in the Midwest Collegiate Cycling Conference and USA Cycling Collegiate Nationals as a Division I team. We provide members with coaching, nutritional products, clothing, and training to help cyclists reach their fitness goals. In addition, we organize non-competitive, social rides to surrounding venues and welcome anyone regardless of skill-level.","wisconsincyclingclub@gmail.com","https://uwmadison.campuslabs.com/engage/organization/wisconsincyclingclub/contact","https://www.instagram.com/wisconsincycling/?hl=en"
"Daily Bread Club","Daily Bread Club is a non-denominational Christian fellowship welcoming students of all faiths, disciplines, and backgrounds - even non-religious! We learn about God through the Bible, self-reflection, Bible study, and worship service. We seek to put God’s word into practice, and we want to help university students do the same. Wherever you stand with questions and beliefs, we invite you to join us as we study the Bible and grow in our understanding of God. His words provide the tools to walk with Jesus for the rest of our lives.
Jesus said, “Therefore everyone who hears these words of mine and puts them into practice is like a wise man who built his house on the rock.” (Matthew 7:24)
Daily Bread Club is part of University Bible Fellowship (UBF), an international campus ministry that began as a grass roots student movement in South Korea in 1961. Through Bible study led by Presbyterian missionaries, the students embraced the gospel and the Great Commission. Today, UBF has chapters in 96 countries. It is supported by lay missionaries who have professional jobs while committed to making disciples of Jesus Christ.","dbaik2@wisc.edu","http://madisonubf.org","No Instagram available"
"Daily Cardinal, The","The Daily Cardinal, the sixth-oldest student newspaper in the country and the most decorated student newspaper in Wisconsin, provides the campus and surrounding community with local news coverage daily. Desks include opinion, graphics, photography, news, arts, sports, science, life and style, satire, podcast, social media and business.
Please email editor@dailycardinal.com if you would like to get involved, or fill out this form on our website to apply.","editor@dailycardinal.com","https://www.dailycardinal.com/","No Instagram available"
"Dancas Dance Club","【What is Dancas?】
  Founded in 2013, Dancas Dance Crew is the largest Chinese student dance crew in UW-Madison. We are a dynamic and high-energy dance crew founded by a group of hip-hop lovers. Over years of development, Dancas haven't stopped gathering excellent dance lovers and providing high quality dance performances to audiences among the UW campus, Dancas always bring their A-game and leave audiences wanting more.
  【What we do?】
  We focuses on various dance styles, including but not limit to: Choreo/Hip-hop, Jazz, Chinese traditional dance, African-style dance, Krump, Popping, Breaking, Locking, etc.. 
We hold regular practices twice a week where we focus on teaching the basics of dancing, including:Flexibility,body power and routine teaching. Every year, we hold an annual showcase that includes all the dance genres outlined above.
Acknowledged by campus, Dancas is frequently invited to perform at events hosted by various student associations with diverse cultural backgrounds. Each of our members is given the opportunity to choreograph their own dance pieces and direct their individual dance videos.
In addition, we hold workshops that aim to promote communication between different dance cultures and provide all students with a chance to learn and experience different styles of dancing for free.
  【How you can get involved!】
  1) Attend our audition at the beginning of each semester and become a member or trainee! Train and perform with us to improve your skills and meet new friends! 
Information will be provided on Instagram or Wechat.
2) Attend our free workshops!
3) Follow our Instagram/Facebook to get updates of our new performances!
-
微信公众号：DancasDanceCrew
Instagram/Facebook: Dancasdancecrew
    Our practices are in turn led by several experienced members. For example, we have members that have practiced Chinese traditional dance, various types of Chinese folk dance and Ballet for over 15 years. We also have members who have practiced Hip-hop dance for over 5 years and are full of performing experience. Furthermore, both of them used to be members of professional dance crews and won several prizes before.
Most of routines we dance are choreographed by our own members. Since we have choreographers that are experienced with different styles of dance, some of their choreography are mixed with different vibes and styles of dance. By learning and practicing such routines, our members could comprehensively improve their dancing skills, and subsequently become more passionate with dancing.
-
Youtube Channel:
https://www.youtube.com/channel/UCeF7oR6GWpYYRaLY3cz7Rhw","dancasdancecrew@gmail.com","https://www.youtube.com/channel/UCeF7oR6GWpYYRaLY3cz7Rhw/featured","No Instagram available"
"Dance Department Student Organization","The Dance Department Student Organization is a student-run organization aimed at academic, educational, and community enrichment of dance students within the Department. It seeks to promote dance in higher education communally, enhance performance opportunities, unite as a Department and make decisions, gain professional dance-related experiences, and serve the student body and community of the University of Wisconsin-Madison.","uwmadisondancedept.studentorg@gmail.com","https://uwmadison.campuslabs.com/engage/organization/ddso/contact","https://instagram.com/ddso_uwmadison?utm_medium=copy_link"
"Dance Elite","Dance Elite is the Official Club Dance Team here at UW-Madison. This student-run club practices twice a week throughout the school year and focuses on jazz, hip-hop, and lyrical technique and choreography. There are many performance opportunities both on campus and out of town, including the UW Homecoming Parade, a Women’s Volleyball halftime performance, competitions within the Midwest, and our special end of year showcase. Our club provides leadership opportunities for members as well as volunteer and fundraising activities.
  Check out our YouTube page and Instagram account to learn more about us!","danceeliteuw@gmail.com","https://uwmadison.campuslabs.com/engage/organization/danceelite/contact","http://instagram.com/danceeliteuw"
"Dance Marathon at UW-Madison","Dance Marathon at the University of Wisconsin-Madison strives to engage the student and local communities to promote children’s health and happiness while fostering the leadership and involvement of participants. Our organization raises funds and awareness for Children’s Wisconsin in Wauwatosa, WI through peer-to-peer fundraising, special events, donations from the community, and engagement with corporate and small business partners in the local area. 100% of our efforts go to promoting the mission and function of Children’s Wisconsin.","dm.uwmadison@gmail.com","https://events.dancemarathon.com/index.cfm?fuseaction=donorDrive.event&eventID=6235","No Instagram available"
"Dane4Dogs, UW-Madison Chapter","Dane4Dogs is a grassroots organization in Dane County, Wisconsin. Our mission is to end the breeding, sale, and use of dogs and cats for painful and distressing experimentation. We support modern scientific alternatives to dog and cat experimentation. The student organization will partner with the larger non-profit organization to focus on educating others about the modern scientific alternatives and advocating for legislation changes to end dog and cat experimentation.","dane4dogs@rso.wisc.edu","http://dane4dogs.org","No Instagram available"
"Data & Analytics Club","","rzepinski@wisc.edu","https://uwmadison.campuslabs.com/engage/organization/dac/contact","No Instagram available"
